{
  "$schema": "./industries.schema.json",
  "version": "1.0.0",
  "generated_at": "2026-06-09",
  "notes": "Seed taxonomy for trend module. 30 industries covering common e-commerce verticals. Add new industries as prospects are tagged that don't fit existing ones. Sub-category queries are starting points — refine based on what pytrends actually returns useful signal for in your real prospect markets.",

  "industries": [
    {
      "slug": "garden_outdoor",
      "name": "Garden & outdoor furniture",
      "description": "Outdoor furniture, garden accessories, BBQs, seasonal outdoor goods",
      "sub_categories": [
        "patio set",
        "bistro table",
        "garden hammock",
        "outdoor sofa",
        "parasol",
        "garden lighting",
        "BBQ",
        "fire pit",
        "outdoor rug",
        "garden chair"
      ],
      "trend_threshold_pct": 25,
      "prospect_cap_per_quarter": 2,
      "seasonal_active_months": [3, 4, 5, 6, 7, 8],
      "primary_countries": ["DK", "SE", "NO", "DE", "NL", "UK", "FI"],
      "enabled": true,
      "notes": "Highly seasonal. Threshold lowered because seasonal moves can be modest in percentage terms but commercially significant."
    },
    {
      "slug": "fashion_women",
      "name": "Women's fashion",
      "description": "Apparel, accessories, footwear for women",
      "sub_categories": [
        "linen dress",
        "slip skirt",
        "oversized blazer",
        "cargo trousers",
        "summer sandals",
        "wrap top",
        "midi skirt",
        "ballet flats",
        "trench coat",
        "knit cardigan"
      ],
      "trend_threshold_pct": 40,
      "prospect_cap_per_quarter": 4,
      "seasonal_active_months": [],
      "primary_countries": ["DK", "SE", "NO", "DE", "NL", "UK", "FR", "ES", "IT"],
      "enabled": true,
      "notes": "High-velocity. Threshold raised because micro-trends are constant — only meaningful movements should qualify. Cap raised to allow more frequent emails."
    },
    {
      "slug": "fashion_men",
      "name": "Men's fashion",
      "description": "Apparel, accessories, footwear for men",
      "sub_categories": [
        "oxford shirt",
        "chinos",
        "leather jacket",
        "raw denim",
        "polo shirt",
        "knitwear",
        "dress shoes",
        "suit",
        "tee basics",
        "wool overcoat"
      ],
      "trend_threshold_pct": 35,
      "prospect_cap_per_quarter": 3,
      "seasonal_active_months": [],
      "primary_countries": ["DK", "SE", "NO", "DE", "NL", "UK", "FR", "ES", "IT"],
      "enabled": true,
      "notes": "Lower velocity than women's fashion. Threshold slightly lower than women's but still high."
    },
    {
      "slug": "beauty_skincare",
      "name": "Beauty & skincare",
      "description": "Skincare products, treatments, ingredients",
      "sub_categories": [
        "retinol serum",
        "vitamin c serum",
        "hyaluronic acid",
        "niacinamide",
        "sunscreen",
        "exfoliant",
        "cleansing oil",
        "retinol cream",
        "eye cream",
        "face mist"
      ],
      "trend_threshold_pct": 35,
      "prospect_cap_per_quarter": 3,
      "seasonal_active_months": [],
      "primary_countries": ["DK", "SE", "NO", "DE", "NL", "UK", "FR", "ES", "IT", "US"],
      "enabled": true,
      "notes": "Ingredient-driven trends move fast. TikTok and beauty blog influence is strong; RSS confirmation signal is especially valuable here."
    },
    {
      "slug": "beauty_makeup",
      "name": "Beauty & makeup",
      "description": "Color cosmetics, makeup tools, brands",
      "sub_categories": [
        "liquid blush",
        "lip oil",
        "contour stick",
        "concealer",
        "mascara",
        "highlighter",
        "lip liner",
        "setting spray",
        "eyeshadow palette",
        "tinted moisturizer"
      ],
      "trend_threshold_pct": 40,
      "prospect_cap_per_quarter": 3,
      "seasonal_active_months": [],
      "primary_countries": ["DK", "SE", "NO", "DE", "NL", "UK", "FR", "ES", "IT", "US"],
      "enabled": true,
      "notes": "Very TikTok-driven. Threshold high because constant noise."
    },
    {
      "slug": "home_decor",
      "name": "Home decor & interior",
      "description": "Decorative goods, soft furnishings, lighting",
      "sub_categories": [
        "wall art",
        "area rug",
        "throw pillow",
        "vase",
        "table lamp",
        "wall mirror",
        "candle",
        "curtains",
        "bedding set",
        "indoor planter"
      ],
      "trend_threshold_pct": 30,
      "prospect_cap_per_quarter": 2,
      "seasonal_active_months": [],
      "primary_countries": ["DK", "SE", "NO", "DE", "NL", "UK", "FR"],
      "enabled": true,
      "notes": "Moderate velocity. Editorial/design magazine influence strong; RSS confirmation valuable."
    },
    {
      "slug": "furniture_indoor",
      "name": "Indoor furniture",
      "description": "Sofas, beds, tables, storage furniture",
      "sub_categories": [
        "modular sofa",
        "platform bed",
        "dining table",
        "bookshelf",
        "storage bench",
        "armchair",
        "tv stand",
        "wardrobe",
        "office chair",
        "side table"
      ],
      "trend_threshold_pct": 30,
      "prospect_cap_per_quarter": 1,
      "seasonal_active_months": [],
      "primary_countries": ["DK", "SE", "NO", "DE", "NL", "UK"],
      "enabled": true,
      "notes": "Lower velocity (large purchase decisions). Cap kept conservative."
    },
    {
      "slug": "sports_fitness",
      "name": "Sports & fitness equipment",
      "description": "Athletic gear, home gym, training tools",
      "sub_categories": [
        "running shoes",
        "yoga mat",
        "resistance bands",
        "kettlebell",
        "foam roller",
        "water bottle",
        "gym bag",
        "weighted vest",
        "compression wear",
        "fitness tracker"
      ],
      "trend_threshold_pct": 35,
      "prospect_cap_per_quarter": 3,
      "seasonal_active_months": [],
      "primary_countries": ["DK", "SE", "NO", "DE", "NL", "UK", "US"],
      "enabled": true,
      "notes": "Event-driven (Olympics, marathons, fitness fads). January spike for resolutions, September spike for back-to-routine."
    },
    {
      "slug": "outdoor_recreation",
      "name": "Outdoor recreation & camping",
      "description": "Camping, hiking, outdoor adventure gear",
      "sub_categories": [
        "tent",
        "sleeping bag",
        "hiking boots",
        "backpack",
        "camping stove",
        "trekking poles",
        "headlamp",
        "rain jacket",
        "cooler",
        "campsite chair"
      ],
      "trend_threshold_pct": 25,
      "prospect_cap_per_quarter": 2,
      "seasonal_active_months": [3, 4, 5, 6, 7, 8, 9],
      "primary_countries": ["DK", "SE", "NO", "DE", "NL", "UK", "US", "FI"],
      "enabled": true,
      "notes": "Spring/summer peak. Nordic + DACH markets are core."
    },
    {
      "slug": "pet_supplies",
      "name": "Pet supplies",
      "description": "Pet food, accessories, care products",
      "sub_categories": [
        "dog bed",
        "cat tree",
        "pet carrier",
        "leash",
        "food bowl",
        "scratching post",
        "pet harness",
        "litter box",
        "chew toys",
        "grain free dog food"
      ],
      "trend_threshold_pct": 30,
      "prospect_cap_per_quarter": 2,
      "seasonal_active_months": [],
      "primary_countries": ["DK", "SE", "NO", "DE", "NL", "UK"],
      "enabled": true,
      "notes": "Steady demand category. Premium pet food trends emerge from health-conscious owner segments."
    },
    {
      "slug": "kids_baby",
      "name": "Kids & baby",
      "description": "Baby gear, kids' clothing, nursery, toys",
      "sub_categories": [
        "stroller",
        "high chair",
        "baby carrier",
        "nursery decor",
        "kids toys",
        "school bag",
        "baby monitor",
        "diaper bag",
        "kids clothing",
        "baby bath"
      ],
      "trend_threshold_pct": 30,
      "prospect_cap_per_quarter": 2,
      "seasonal_active_months": [],
      "primary_countries": ["DK", "SE", "NO", "DE", "NL", "UK", "FR"],
      "enabled": true,
      "notes": "Back-to-school spike in August. Holiday gifting spike in November-December."
    },
    {
      "slug": "food_beverage_specialty",
      "name": "Specialty food & beverage",
      "description": "Premium food, craft producers, gourmet goods",
      "sub_categories": [
        "specialty coffee",
        "natural wine",
        "craft chocolate",
        "premium tea",
        "olive oil",
        "hot sauce",
        "single origin coffee",
        "natural snacks",
        "fermented foods",
        "craft liquorice"
      ],
      "trend_threshold_pct": 30,
      "prospect_cap_per_quarter": 2,
      "seasonal_active_months": [],
      "primary_countries": ["DK", "SE", "NO", "DE", "NL", "UK", "FR", "IT"],
      "enabled": true,
      "notes": "Gift-giving seasons important: Easter, Mother's Day, holidays. Includes Nordic specialty producers like Lakrids by Bülow."
    },
    {
      "slug": "wellness_supplements",
      "name": "Wellness & supplements",
      "description": "Vitamins, supplements, wellness tools",
      "sub_categories": [
        "magnesium supplement",
        "vitamin d",
        "collagen powder",
        "ashwagandha",
        "creatine",
        "protein powder",
        "essential oils",
        "massage gun",
        "sleep aids",
        "electrolyte drink"
      ],
      "trend_threshold_pct": 35,
      "prospect_cap_per_quarter": 3,
      "seasonal_active_months": [],
      "primary_countries": ["DK", "SE", "NO", "DE", "NL", "UK", "US"],
      "enabled": true,
      "notes": "Influencer-driven trends move fast. TikTok and YouTube health content drives many spikes."
    },
    {